{
  "requester": {
    "name": "Richard Maynard",
    "email": "cmljaGFyZC5tYXluYXJkQGdtYWlsLmNvbQ==",
    "organization": "Independent Technomancer",
    "website": "https://richardmaynard.dev"
  },
  "tribute": {
    "subdomain": "richardmaynard",
    "delegation_ns": [
      "ns1.richardmaynard.dev",
      "ns2.richardmaynard.dev"
    ],
    "purpose": "To formally contribute operational elegance, DevOps acumen, and SigilStack governance to the Realm.",
    "public_keys": {
      "pgp": null,
      "dnssec": null
    },
    "optional_metadata": {
      "sigil_version": "v1.0.0-rc",
      "artifacts_url": "https://richardmaynard.dev/signatures",
      "squall_support": true
    }
  },
  "legal": {
    "accept_terms": true,
    "license": "Apache-2.0",
    "liability_acknowledged": true
  },
  "notes": "This tribute reflects deliberate order applied to distributed absurdity. It complies with the King's Charter ยง9.3(e)."
}
